display-name,publication,review-text,original-score-and-url,original-score-and-url 2
Don Shanahan,Every Movie Has a Lesson,"Just as the dictionary definition of ""spectacle"" states, the blockbuster is unusual, notable, and entertaining in an eye-catching, dramatic, and very public way.  It is big, loud, and dumb, but, hot damn, it sure is fun.","| Original Score: 4/5
                
                |","Sep 4, 2023"
Sean Axmaker,Stream on Demand,"... a lot of fun, part mindless two-hour theme park ride, part self-aware sequel where supposedly smart people make a cascade of bad decisions.",|,"Aug 20, 2023"
Benjamín Harguindey,EscribiendoCine,"Jurassic World lacks heart because everything happens on the same level of fast-paced, forgettable entertainment. [Full review in Spanish]","| Original Score: 7/10
                
                |","Feb 28, 2023"
Keith Garlington,Keith & the Movies,"The visual spectacle, the dinosaur fights, the theme park environment all work to immerse you in a really cool setting. It’s too bad the underwhelming story, narrative hiccups, and bland characters drag it down to passable but forgettable levels.","| Original Score: 3/5
                
                |","Aug 22, 2022"
Brian Eggert,Deep Focus Review,"It’s sharp, well-made, knowing entertainment that’s also the first sequel worthy of the original masterpiece.","| Original Score: 3.5/4
                
                |","Jun 9, 2022"
Alan French,Sunshine State Cineplex,"The action-adventure comedy still has its fair share of missteps, but in the context of the Jurassic Park saga, it remains one of the few popcorn films to deliver on its blockbuster promise.","| Original Score: 7/10
                
                |","Jun 7, 2022"
Cory Woodroof,Williamson Home Page,"As far as Jurassic movies go, this isn't Jurassic Park, but it never had to be. The film is a reverent, effective follow-up to a classic. That, folks, is what we call no small feat.",|,"Feb 11, 2022"
Anne Brodie,AWFJ.org,"Jurassic World is the way to go - the nostalgia factor, new CGI and a nature defying gamble. Chris Pratt is charm on wheels and I'm rooting for Bryce Dallas Howard who has been away too long.",|,"Oct 4, 2021"
Hosea Rupprecht,Pauline Center for Media Studies,"As I watched the really neat digital dinos chase people around, the scenes that resonated most with me were the ones that took place in the park's laboratory.",|,"Sep 13, 2021"
Nick Levine,NME (New Musical Express),This is the first sequel to do the original Jurassic Park movie any real justice...,"| Original Score: 4/5
                
                |","Jun 4, 2021"
Nikki Baughan,AWFJ.org,"Stepping into the lead is man-of-the-moment Chris Pratt, fresh from his Guardians of the Galaxy success, and he is joined by the substantial talent of Bryce Dallas Howard...",|,"Apr 22, 2021"
Mike Massie,Gone With The Twins,"Several sequences of dinosaur carnage are expertly crafted and thoroughly entertaining, even if they're repetitive of previous entries in the franchise.","| Original Score: 6/10
                
                |","Dec 4, 2020"
Richard Propes,TheIndependentCritic.com,"It's easily the best of the sequels, but it certainly falls short of the original's sense of surprise and spontaneity that marked the original.","| Original Score: 3.0/4.0
                
                |","Sep 13, 2020"
Kelechi Ehenulo,Confessions From A Geek Mind,"Whilst it will never touch the greatness of the original and shamelessly predictable, Jurassic World is a positive entry in the franchise.","| Original Score: 3/5
                
                |","Jul 17, 2020"
Allen Almachar,The MacGuffin,"If you squint really hard, you might find this to be good old dumb fun. But honestly, how long can you do that before getting a headache?","| Original Score: C+
                
                |","Jul 15, 2020"
Brent McKnight,The Last Thing I See,"Clumsy, full of flat, dead-eyed characters, and is an obvious cash grab. But somehow none of that matters when there are rampaging dinosaurs on screen.","| Original Score: B-
                
                |","Jul 5, 2020"
Damond Fudge,"KCCI (Des Moines, IA)","Overall, Jurassic World delivers. It's everything you probably want or expect from a summer blockbuster sequel. It's still scary when it needs to be, funny when it tries and a worthy continuation of the story.",|,"Jul 1, 2020"
Matthew Rozsa,Good Men Project,"Yes, I said it. ""Jurassic World"" SUCKED! What the hell was I missing?","| Original Score: 2/4
                
                |","Jun 11, 2020"
Sergio Benítez,Espinof,"The production flirted dangerously with the ""video game phase"" syndrome that had done so much damage to the previous two installments of the franchise. [Full Review in Spanish]",|,"May 7, 2020"
Alberto Abuín,Espinof,Once again MacDonald's cinema at our service: fast consumption and instant forgetfulness. [Full Review in Spanish],|,"Apr 28, 2020"
Avaryl Halley,Movie Bitches,"It was very cynical, which bummed me out.",|,"Apr 28, 2020"
Andrew Galdi,Movie Bitches,This movie should not exist.,|,"Apr 28, 2020"
Tim Brennan,About Boulder,"It doesn't help that the screenplay, credited to four writers, repeatedly veers into the idiotic.",|,"Feb 13, 2020"
Chris McCoy,Memphis Flyer,"Jurassic World is not a misfire, just a pale reflection of Jurassic Park... But I had fun rooting for the dinosaurs anyway.",|,"Jan 10, 2020"
David Harris,Spectrum Culture,Jurassic World doesn't even come close.,"| Original Score: 1.75/5
                
                |","Dec 3, 2019"
Joey Keogh,Wicked Horror,"An accomplished sequel, and a delightful stand-alone picture in its own right, at its core, Jurassic World is cheesy, dumb, balls-to-the-wall crazy fun.","| Original Score: 8/10
                
                |","Sep 26, 2019"
Karl Delossantos,Smash Cut Reviews,"Despite my view of the film as a satire, there are a few storylines that bogged down an otherwise quick fire film.",|,"Aug 8, 2019"
Leslie Combemale,Cinema Siren,There are still enough moments of excitement and wonder to inspire audiences to take the dino-bait and commit to seeing Jurassic World through to the end.,"| Original Score: 3/5
                
                |","Aug 5, 2019"
Ryan Syrek,"The Reader (Omaha, NE)","Jurassic World is terrific spectacle paced perfectly and infused with more humor than any previous installment of the series. It is grownups playing with dinosaur toys, and if you did that as a kid, you'll leave with a big, dumb grin on your face.","| Original Score: B+
                
                |","Jul 30, 2019"
Mattie Lucas,"The Dispatch (Lexington, NC)",A welcome return to form for a beloved franchise that delivers the goods for a whole new generation.,"| Original Score: 3/4
                
                |","Jul 5, 2019"
Daniel Orton,One Room With A View,Jurassic World possesses what this series has lacked since Jurassic Park: heart.,"| Original Score: 4/5
                
                |","May 8, 2019"
Rachel Wagner,rachelsreviews.net,This whole plotline even for a stupid popcorn movie was so ridiculous,"| Original Score: C
                
                |","Apr 26, 2019"
Ruth Maramis,FlixChatter Film Blog,"Jurassic World is nothing more than popcorn cinema and no less disposable as the nameless extras gobbled up by Indominous Rex. I suppose if you expect a ton of dino-chomping action and chase scenes, then you probably enjoy this movie.","| Original Score: 3/5
                
                |","Mar 5, 2019"
David Ocadiz,Cinergética,"With spectacular action scenes and great directing from Colin Trevorrow, Jurassic World is a film that you can't miss. [Full Review in Spanish]",|,"Feb 15, 2019"
Ed Travis,Cinapse,Colin Trevorrow proved more than up to the task of creating what is easily the second best Jurassic film.,|,"Feb 3, 2019"
Nathalia Aryani,San Diego Entertainer,"While no sequel can capture the magic of the original, an instant classic, there is a plethora of edge-of-your-seat, prehistoric wonders in Jurassic World.",|,"Jan 23, 2019"
Micheal Compton,Bowling Green Daily News,"When the dinosaurs take center stage, Jurassic World really kicks into gear -- enough to overlook all the distractions to get to that point.","| Original Score: B-
                
                |","Jan 23, 2019"
Amanda Greever,The Daily Times (Tennessee),"Jurassic World doesn't have the same beauty - and overwhelming awesomeness - of the original, but it offers a hint of something we loved many years ago and still adore.",|,"Jan 10, 2019"
Abbie Bernstein,Assignment X,"For those who see the glory in these dinos, they're worth putting up with a lot, including the rest of the movie that surrounds them.","| Original Score: B-
                
                |","Dec 18, 2018"
Zaki Hasan,Zaki's Corner,Effectively turns the lights back on for the mothballed franchise while also setting a sturdy foundation for any future such expeditions.,"| Original Score: B-
                
                |","Nov 4, 2018"
Debbie Baldwin,Ladue News,"I had a bit of trouble keeping my eyes on the screen because I was rolling them, but the acting is good, the suspense is white-knuckle and the pace is breakneck.","| Original Score: 6/10
                
                |","Nov 2, 2018"
Jennifer Heaton,Alternative Lens,"Ultimately, the film doesn't have anything new to say about the series on a thematic level that hasn't already been hammered into our head.","| Original Score: 7/10
                
                |","Nov 1, 2018"
Johnny Gayzmonic,Fanboys of the Universe,"Instead of responding with a tremendous roar of confidence, the response is a mighty yawn of 'Eh, I don't know. Dinosaurs, man.'","| Original Score: 5/10
                
                |","Oct 31, 2018"
Aaron Peterson,The Hollywood Outsider,"If you are looking for a rambunctiously exciting trip to the theater with the family in tow, Jurassic World is the theme park ride of the summer.","| Original Score: 7/10
                
                |","Oct 24, 2018"
Nguyên Lê,The Script Lab,"To realize that [Jurassic Park] has humans interacting with dinosaurs and [this] is all about the creatures, one can't help feeling rather incomplete despite being constantly entertained.",|,"Oct 10, 2018"
Rubén Rosario,MiamiArtZine,Trevorrow is too busy making a point about theme park culture and movie sequels to make us feel the slightest bit of suspense.,|,"Aug 22, 2018"
Danielle Solzman,Solzy at the Movies,"Upon further review, Jurassic World is just as awesome and nostalgic as it was when the film first graced the big screens in 2015.",|,"Jun 18, 2018"
William Evans,Black Nerd Problems,"Everything else, and I mean, damn near everything in Jurassic World that works to any effect has been done before. But better. And when it was original.",|,"Jun 13, 2018"
Mark Graham,Decider,Romantic leads [Pratt and Dallas Howard] are...charisma-free... but that doesn't mean there aren't some worthy moments: the Indominus Rex getting straight up savage on a group of overmatched mercenaries in the jungle.,|,"Jun 7, 2018"
Oggs Cruz,Rappler,"Sadly, Trevorrow's ambitious set-up is betrayed by a filmmaking style that blatantly lacks personality.",|,"Apr 23, 2018"
Megan Basham,WORLD,"Summer moviegoers cannot live by superheroes alone, and darn if the entire time my grown-up, film critic head was saying, This is so stupid, some little-kid corner of my heart wasn't crowing, and yet so awesome.",|,"Mar 16, 2018"
Andre Meadows,Black Nerd Comedy,"Jurassic World is fun if you don't compare it to the original, if you look at it as a standard monster movie and if you can get through the first thirty minutes of it. If you can do that, definitely go see it.",|,"Mar 2, 2018"
Daniel Krauze,El Financiero,"Gray and Zach are not round characters, but necessary evils, included for the sole purpose of having someone threatened by the carnivore ... [Full review in Spanish]",|,"Jan 12, 2018"
Uri Klein,Haaretz,"A massive disappointment, Jurassic World fails to emulate its three predecessors in Spielberg's horror series.",|,"Jan 12, 2018"
Hugo Hernández Valdivia,Cinexcepción,"Although this is not particularly extraordinary, it advances the story with good rhythm and clarity. [Full review in Spanish]","| Original Score: 6/10
                
                |","Dec 12, 2017"
Robert Kojder,Flickering Myth,It's only until the final 30 minutes where things really heat up and ultimately conclude with a battle that is admittedly freaking awesome,"| Original Score: 3/5
                
                |","Dec 3, 2017"
Matthew Bond,The Mail on Sunday (UK),"You never find yourself thinking ""Wow, great visual effects,"" and that's because the underlying story is so cleverly constructed and strong, particularly when it comes to pacing and the tying of the new film to the original.",|,"Oct 30, 2017"
Brooke Corso,"The Monitor (McAllen, TX)",We have a film that has done the unthinkable: made a gazillion dollars despite a convincing argument that it puts full blame on its own audience for what it has become.,"| Original Score: C
                
                |","Aug 16, 2017"
Sr. Rose Pacatte,National Catholic Reporter,"Jurassic World is about evolution in a test tube in a lab run by a corporation for profit with military application of the ""assets."" What comes next is anyone's guess.",|,"Aug 10, 2017"
Abby Olcese,Sojourners,"This latest sequel to Jurassic Park doesn't know what it wants to be, and therein lies the problem.",|,"Jun 26, 2017"
Danielle Riendeau,Polygon,"Taken entirely on its own merits, Jurassic World is big and exciting and well-paced, the tension is wisely doled out so that action and disaster never feel far away, and once the... really starts to hit the fan, the movie fully comes into its own.",|,"Jun 2, 2017"
Aramide Tinubu,Shadow and Act,"Jurassic World is a visually striking thrill, packed with enough adventure to leave even the most cynical 21st century viewer in awe. Though the storyline itself brings little originality, its cheesiness is oddly endearing.",|,"Apr 12, 2017"
Sonny Bunch,Washington Free Beacon,Messy nostalgia trip could bring back turtleneck sweaters.,"| Original Score: 2/4
                
                |","Jul 14, 2016"
Max Weiss,Baltimore Magazine,"The whole thing is an elaborate fantasy, so it seems a bit churlish to say, ""that's not believable!"" But even a film like this needs some internal logic.","| Original Score: 2/4
                
                |","Jun 10, 2016"
Ed Power,Irish Independent,"As is the vogue among the current generation of blockbusters, it feels like the entire point here is to evoke memories of older, better movies. By those admittedly narrow standards, Jurassic World constitutes a roaring, stomping triumph.",|,"Jun 1, 2016"
Mark Jackson,Epoch Times,Die-hard fans insist no new 'Jurassic' movie could ever touch the original. Oh yeah? Come again? 'Jurassic World' just completely blew the doors off 'Jurassic Park.',"| Original Score: 4/5
                
                |","May 29, 2016"
Paul Whitington,Irish Independent,"For long periods, to be fair, Jurassic World is easy to watch and pretty entertaining, especially when Chris Pratt is on the screen.","| Original Score: 3/5
                
                |","May 24, 2016"
Dee O'Donoghue,Film Ireland Magazine,"Narratively continuous to the original film but slightly disregarding its two sequels, Jurassic World is a spectacular rush of furious energy, spellbinding awe and alarming terror from beginning to end.","| Original Score: 4/5
                
                |","May 12, 2016"
Russell Baillie,New Zealand Herald,"This new one is easily the best sequel of the bunch. It's frequently exciting, happily, forgivably ludicrous if a little too pumped-up for its own good and less than memorable.","| Original Score: 3.5/5
                
                |","May 6, 2016"
J. Olson,Cinemixtape,So adeptly does it roll sugar rush and brain freeze into one that it might as well come served in a paper cone.,"| Original Score: 4/5
                
                |","Apr 14, 2016"
Bill Newcott,AARP Movies for Grownups,"What could possibly go wrong? Luckily for viewers, everything-and almost immediately.","| Original Score: 4 of 5
                
                |","Apr 11, 2016"
Marija Djurovic,Cairo360,"This is a top popcorn movie, so to speak, but just lacks the sheer magnitude in ingenuity of the original.","| Original Score: 2.5/5
                
                |","Apr 6, 2016"
Edmund Lee,South China Morning Post,This fourth instalment does well to supplement the 3D spectacle with lively characters and good humour.,"| Original Score: 4/5
                
                |","Apr 2, 2016"
Martin Roberts,Fan The Fire,"If its primary function is ultimately to remind all the oldies how brilliant Jurassic Park was, and simultaneously to inspire a new generation of kids to go and check it out, then that's surely a good thing.","| Original Score: 3/5
                
                |","Feb 26, 2016"
Eileen Jones,The Jacobin,"The price you pay for delightful dinosaur carnage is, as always, dwelling in the Spielberg-patented world of regressive gender roles and worship of the white middle-class nuclear family.",|,"Feb 26, 2016"
Jared Mobarak,The Film Stage,"The film may not match the brilliance of the original, but it definitely rekindles some of those feelings as an entertaining bright spot this summer season.","| Original Score: B
                
                |","Feb 22, 2016"
Kyle Anderson,Nerdist,"It is not much like the first one, but if you like a very well-designed and well-directed piece of dino-damaged cheese, then I think you'll have a good time. I certainly did.","| Original Score: 3/5
                
                |","Jan 2, 2016"
Marie Asner,Phantom Tollbooth,"As far as acting, the cast does well.","| Original Score: 3/5
                
                |","Jan 1, 2016"
Alex Zane,The Sun (UK),"This was never going be as good as Spielberg's masterpiece and, surprise, surprise, it isn't. It's simply a solid summer blockbuster and the second best of the series.","| Original Score: 3/5
                
                |","Jan 1, 2016"
Jasper Rees,The Arts Desk,"Jurassic World is intensely conscious of its Spielbergian forebear, doffing its cap in multiple nods and winks.","| Original Score: 4/5
                
                |","Jan 1, 2016"
Violet LeVoit,AllMovie,"[Director Trevorrow's] vision for Jurassic World is enchanting, gratifying, and sure-handed in a way that's uncannily like Spielberg's early period.","| Original Score: 4.5/5
                
                |","Dec 3, 2015"
Margot Harrison,Seven Days (VT),"In short, this film could have used a Rise of the Planet of the Apes treatment.","| Original Score: 3/5
                
                |","Dec 1, 2015"
Dennis Schwartz,Dennis Schwartz Movie Reviews,It works as an entertaining lightweight thriller especially engineered for the theme park crowd.,"| Original Score: B-
                
                |","Nov 20, 2015"
Katherine Monk,Ex-Press.com,Some things change. Others evolve. And some things are cooked up in a lab as genetically modified sequels to something original.,"| Original Score: 3.5/5
                
                |","Nov 16, 2015"
John Beifuss,"Commercial Appeal (Memphis, TN)","'Jurassic World' is a film that critiques its own mission. It is aware that moviegoers, awash in blockbusters and computer-generated movie 'magic,' are increasingly hard to awe.","| Original Score: 3.5/4
                
                |","Nov 5, 2015"
Alex Leadbeater,What Culture,The least awful sequel.,"| Original Score: 3/5
                
                |","Nov 5, 2015"
Jeff Beck,The Blu Spot,"Jurassic World is a massive disappointment with a multitude of flaws, from the retreaded story and endless, monotonous action sequences, to the flat, lifeless characters and the uninspired CGI dinosaurs.","| Original Score: 2/5
                
                |","Oct 21, 2015"
Nick Dent,Daily Telegraph (Australia),It's a retread of Jurassic Park with extra corn and less suspense.,"| Original Score: 2.5/5
                
                |","Oct 20, 2015"
Nandini Ramnath,Scroll.in,"Events move at a fast clip, the paleontology talk is kept to a minimum, the computer-generated effects are beautifully realised, and the characters perform their parts with the required efficiency.",|,"Oct 20, 2015"
Alex Abad-Santos,Vox,Jurassic World is the reason summer movies exist.,"| Original Score: 4/5
                
                |","Oct 20, 2015"
Matthew Turner,WOW247,"Overall, this is an enormously entertaining thriller that will delight both newcomers and die-hard fans of the first film alike.",|,"Oct 20, 2015"
Cameron Meier,Orlando Weekly,"The fourth installment in the Jurassic series is spectacular summer entertainment, a sort of Cecil B. DeMille on speed.","| Original Score: 3.5/5
                
                |","Sep 25, 2015"
Beth Accomando,KPBS.org,Here's the deal: The dinosaurs still take our breath away but the film does not.,|,"Sep 11, 2015"
Tom Meek,Cambridge Day,"Crichton's cautious, forward-looking book had Frankenstein underpinnings: Don't mess with Mother Nature, or the past. The curators of the park do both, the filmmakers do the latter.","| Original Score: 2.5/4
                
                |","Sep 11, 2015"
Rob Carnevale,Indie London,Jurassic World is a surprisingly thrilling blockbuster experience that should leave fans roaring with approval.,"| Original Score: 4/5
                
                |","Aug 26, 2015"
Pablo Villaça,Cinema em Cena,"Se há alguém que sai como o grande destaque de Jurassic World, este é seu diretor.","| Original Score: 4/5
                
                |","Aug 25, 2015"
Scott Weinberg,TheHorrorShow,"When it's focused on chases, scrapes, escapes, and all-out dino-frenzy ACTION, there's a good deal of fun to be had.",|,"Aug 22, 2015"
Helen O'Hara,GQ Magazine [UK],Trevorrow never quite finds the moments that made the first film so transcendent.,"Full Review
                
                
                |","Aug 14, 2015"
Clem Bastow,Junkee,Oh boy is 11-year-old me equal parts pleased and relieved that 33-year-old me can report that Colin Trevorrow's entry into the series is a hoot.,|,"Aug 14, 2015"
Steve Biodrowski,Cinefantastique,"After two miserable sequels, the world had no reason to expect anything good from another Jurassic Park movie...yet, in spite of every ill omen, Jurassic World turns out to be the most enjoyable blockbuster in recent memory.","| Original Score: 4/5
                
                |","Aug 7, 2015"
Josh Terry,Deseret News (Salt Lake City),"It's a fun summer ride, but it won't keep you coming back over and over.",|,"Aug 5, 2015"
Iain McNally,Starburst,Definitely worth the price of admission.,"| Original Score: 8/10
                
                |","Jul 29, 2015"
Glenn Dunks,Glenn Dunks,"When the script isn't simply recreating famous scenes from the original with less engaging characters who speak a lot and yet say so very little, it's blindly ignoring plot holes and conjuring up half-baked ideas...","| Original Score: B-
                
                |","Jul 2, 2015"
Matthew Toomey,ABC Radio (Australia),"Credibility issues aside, Jurassic World is worth seeing for the pure spectacle.","| Original Score: B+
                
                |","Jul 2, 2015"
Fr. Chris Carpenter,Movie Dearest,See the movie for its reptilian stars but try to ignore the humans. The retro gender politics employed are disappointing.,"| Original Score: B-
                
                |","Jun 29, 2015"
John Rico,About.com,"Dinosaurs escape, people get eaten. Same old story but with bigger dinosaurs; fun but fleeting.","| Original Score: 1-5
                
                |","Jun 28, 2015"
David Nusair,Reel Film Reviews,The best of the Jurassic Park sequels by a hair...,"| Original Score: 3/4
                
                |","Jun 26, 2015"
Nick Rogers,Midwest Film Journal,"This isn't an annoyingly self-reflexive shredding of its forefather. It's very much its own smart, sleek endeavor with momentum, confidence ... and minor drawbacks. In all, it's pulpy summer fun with more on its mind than first glance may reveal.","| Original Score: 4/5
                
                |","Jun 25, 2015"
Norman Wilner,NOW Toronto,"Jurassic World functions precisely the same way as a theme park does, gliding the spectator through a series of calibrated set pieces.","Full Review
                
                
                    | Original Score: 3/5
                
                |","Jun 25, 2015"
J. R. Jones,Chicago Reader,"The characters are all paper-thin, but that doesn't matter because their sole purpose is to get chomped.",|,"Jun 25, 2015"
Rich Cline,Contactmusic.com,"With studios afraid of anything new or original, it's not surprising that the dinosaurs are back on-screen nearly 15 years after the rather disappointing Jurassic Park III.","| Original Score: 3.5/5
                
                |","Jun 24, 2015"
Mark R. Leeper,Mark Leeper's Reviews,re-used dinosaurs and re-used plot. But most of us can always enjoy watching the dinosaurs.,"| Original Score: 6/10
                
                |","Jun 23, 2015"
Gary Dowell,Dark Horizons,The darn thing is truly scary as hell.,|,"Jun 23, 2015"
Wesley Lovell,Cinema Sight,"It's certainly exciting and entertaining, but there is now splendor or awe-inspiring inventiveness.","| Original Score: 3/4
                
                |","Jun 22, 2015"
